{
  "schema_version": "skillguard.depth_profile.v2",
  "profile_id": "profile:single-check-target",
  "target_skill_id": "single-check-target",
  "integration_mode": "native-integrated",
  "native_owner_id": "owner:single-check-target",
  "native_route_ids": ["route:target-work"],
  "native_check_ids": ["check:target-result"],
  "model_deepening_check_id": "check:target-result",
  "surface_inventory": {
    "path": ".skillguard/surface-inventory.json",
    "adequacy_check_ids": ["check:target-result"],
    "model_deepening_check_id": "check:target-result"
  },
  "skillguard_adds_domain_route": false,
  "enforcement_level": "enforced",
  "required_closure_profiles": ["enforced"],
  "provider_runtime": {
    "provider_id": "skillguard-local-provider",
    "required_runtime_contract_id": "skillguard-declared-check-supervision-current",
    "required_capability_ids": ["declared-check-receipt-reconciliation.v1"],
    "required_enrollment_status": "enrolled",
    "readiness_check_ids": ["check:target-result"]
  },
  "claim_boundary": "One target-declared check only."
}
